 Noun,Adjectives and Verbs
kmh,minmax mph scooter peak rebound term gpsr trademill speed average car maximu
input,treadmill varies coach sharingdirection weight lol gender malefemale goal height maratho
easytouse,lightweight network criterion fit mess login thru are
challenge,community ability beat engage angle w route pre segment odometer trackpath lol muti goal allows marathon categoriz
encourage,routespls stops annotation ex boater meh distance fo
access,oops list history sorry need privacy bow accept spyware grate jerk pirateware placeme intrusive read invasive privilege grab explain logger invasion ask overreach routine loc c call contact dobt bitch collection comm permission calendar identit
firmware,provocation mytracks nature htc treating googlemapway eror become article comingpackge bill sensatio
colour,mountians oof represent variety kph body hello plz composition pace topograph
asap,mock package signing chromecast teeks lisence bod wont attention iuse please solve platform camnot fix thanks magnus acknowledg
geo,visualizer annotation capture logging camera pre photos fetch fashion enjoyment sm photo synhronis
put,shelf picture drift constrains pi
load,everytrail mytracks nature gap mapmyrun action apps cpu optimus decision launcher bill myvtrcks 
noisy,recognize instance meaningless chipset le stability sourse glo antenn
mm,precaution lobe competitor thing framewor
tge,developer attention know identit
decision,everytrail mytracks nature hardcore action apps fit mapmyxxxx optimus load article hugh bil
nexus,rock wkit brand exportsimports cm101 gnex mapmywalk kat malaysia stoc
document,photoroute kmshr tnx family driving grrrrr
bold,extent wan letter curiosity number becomes flick home cycle death screen loc
handy,cake wantneed benefit chromecast counter awesome simplicity playback hike
shite,join correlation treadmill goole punch atv lll screenhow fashion seperate consistency markerswaypoints grey steppe
resembles,trip plot whole miscalculate spb freeze froz
begreat,ideal runbike routespls fly wantneed disappointment mtn fir frustrate dony annotation itd crashing whilst mapmyfitness improovments wherever boater transport exploratory motorcycle wheelchair fashion acuracy halfway calculationstat installg dir
scout,place blank mark spot upload hunt isue pin marke
mio,link alpha connects monitor bpm rate ship bloatware miolink synchs heart monitoring energy cadence smart zone preet
s5,tatoo cake wasnt performance seat cumbersome ons ild samsumg fitbit wider i9082 kind
clue,render consumption outdoors mention le
go,towards pattern speedometer neighbour hibernates dot neighbourhood backwards road house asks floor bottom elivation yard drawn po fluctuates happrns haywire university programmer gui select
i8150,wonder ypu samsung infuse captivate ray alarm phone not
calaries,waypoints driver walk instruction burn section paste tanker wile sgs
motorbike,weekyear penultimate today bike asks vs night bother ride le
heart,appreciate alpha connects party bluetooth monitor bpm obstruction rate ship h7 compatibility australia miolink strap synchs mio monitoring energy training hxm cadence smart target zone preet
footprint,verge garman faulty googlemapway useless somebody everythin
retrace,twitter otg host follo
detail,history loc mate comm tap fil
geotag,csv visualizer generate camera tool gpx sm photo somebody fil
sure,goodness unistalling iphone counterpart sky airplane bos nea
sensor,bomb ton wireless meant ant lack zephyrpolarlike colorado support bluetooth wearlink speedcadance finer foothill h7 compatibility refer reference health hrms energy potential glo ie garmin runhike toppeak zephyr hxm cadence hrm panobike hoo
train,backlog shd import tip maximu
measurments,thicker stoppe
metre,india unit system matric quirk australia kilojoules foot kilometer sail preference mikm kilometre kno
halfway,geology waypoints discrepancy competition walk coffee flight adventure improovments motor transport nebraska googlemaps form instruction china feb2014 z1 illinois begreat walking enjoyment progres
sky,vision day obstruction sure confirm clou
home,extent wan hibernates curiosity whole avoid blank tablet lag becomes flick cause brokenwill percent ginger bold kayaker death cuz screen widget lock difficult
constrains,gplay shelf agreement data put jungle author corrup
ground,child middle round floor nope buildin
complain,everyone tolerance accuracy dropout nope converter gis shp piece thirdparty softwar
miner,gplay presentation shelf imp privacy hole conection mining collect agreement invasion lobe data mountain race sunday collection storage corrupt reconnect
fringe,everytrail success imho apps beast mapmyxxxx bloody alltrails improvise 
empty,choose directory square landscap
match,holo fast precision ness accurate photos simpleuser multitud
s4,ace i9003 tatoo galaxy q mini galax exllent samsung bummer captivate speedcadance scl lll samsumg s2 pad2 ii health note i9082 player mikm backyard kind
crapware,charm bummer instal neats camands fitness kind
initiate,ordnance option reliably boatie
clog,management hate jerk frustration installs grab memory overreach consistency boo
ladmarks,waypoints sum type motor outdoor instruction workout rambler aggregate cycle wearcarry activity past
attach,punch waze mean venue difficult
expiry,holo stutter kmshr lightweight development versatility interface capability tidy simple multitude makeover share ui band scheme fc
meter,mod couple kangaroo feetmiles foot kilometer reality travel registe
quality,mock bt chipset percentage miolink platfor
process,overlay kmz feb2014 winter format capacity thirdparty weblin
entry,location place river deletion mylocation beside
share,textfacebook doc link mapdata twitter email owner kmshr fb raja g lightweight wordpress tnx family capability medium ae picture profile multitude option expiry english pic grrrrrr blog facebook image posibillity gfaceboo
afterward,interacts benefit thanx alot startup rute addition rotation standard mapsna
lawyer,indication wise continuation giv
google,juncky map drive mapsnavigator earth syncs integration browse mapsna
face,map icon mode r let touris
happrns,bulldozer thicker adventure road verdoon floor satelites elivation go haywire programmer za
shoot,location fast bus photos haywire tou
miscalculation,hasbeen programme esta messager worthy firmado correctamente e
internet,tunein radio imp logging chanel networks arg connectivity planet pointless a88 service connection fm availabilit
draw,pattern neighbour dot crazy neighbourhood seat house sit desk left chair haywire couc
converter,arcgis uploads wow adobe wonder convert lightroom kmz kml nothing complain gis shp format thirdparty coaster mytrack softwar
loc,list history sorry need bow spyware grate jerk pirateware read privilege grab explain logger overreach fashion access detail c call disappears contact dobt bitch collection comm permission calenda
freebee,limit cumbersome name tidy scheme cyclemete
reset,directory backup trailerror factory copy whitney wind forgo
phone,grandpa hardware i8150 antenn
gpx,wow csv transfer computer sdcardmytracks visualizer generate export kmz tile kml select timestamps exportsimports kmlgpx import tip gpslogger clumsy send geotag contain format somebody file folder isnt pc inconvenien
employee,vice nt punch shuts whatsapp hardcore head navihation synch mind versa markerswaypoint
exercise,day bike circui
slaughter,locus dumb placeme avail look forwor
eats,toggle hog imp battery life usage cpu eater drain wapp death zl killer widge
preference,change unit system australia stopper metr
hell,minmax sorry pirateware elivation yar
hint,minute duty discrepancy talk hour half sec run timebattery mil
gee,psw problem photoroute feetmiles alwaays improovments recorder utility serf favourite redesign tho
trailerror,humidity temperature miss avail host option reset boatie
hike,trip re geocache squa
gis,arcgis convert edit export kmz view kml desktop complain converter format facility thirdparty coaster software unloc
installation,updating failure signet signend package sign dumb ware messager fails gus reload qa lisence bravo guys status thats install solve say agnes error messag
contain,wow csv value kmz kml timestamps syncs gpx format file thirdparty p
kayaker,trip problem home reality chun
superman,eyeroll north hour imho right xperiau unistalling desk left gb yeh flame yea
monitoring,alpha hasbeen connects monitor bpm obstruction rate pls ship compatibility australia miolink ruin synchs pedometer mio heart energy training cadence smart target zone preet
cycle,river jump walk motor acuracy bold ladmarks tour granularity besides beginnin
field,game geology shouldnt millisecond soccer inability form buggy year maps month inclusio
energy,alpha bt support bluetooth monitor bpm rate ship h7 compatibility australia miolink synchs mio heart sensor monitoring hxm cadence smart target hook zone preet
enjoy,shouldnt rest cumbersome fancy thirdpart
begin,remain stat googlema
bikers,minmax ex beginner expert rebound meh mountain distance fox increase spee
playlist,reviewer antenna receive
altitude,sea confusion foot bear gain enlarge leve
ring,contactsy text shuts navihatio
haywire,pattern response neighbour dot crazy neighbourhood adventure house sit floor bullshit chair fall kmph go happrns shoot draw universit
filter,group sum type powerhouse rating monthweek noise hidden piece novelty activit
paul,concept enhancement benefit success cumbersome sportstracker notch gripe heartbeat pausestart alot competitor bloody improvis
timing,color disappear timedist seat style runrest lap split custom havent nic
hence,take network inacurate fetch jungle locate ag
generates,heat droppin number pre sea generation kill processor leve
roadtrip,mobile lost ge
article,provocation garman mytracks nature pass treating googlemapway eror mihr firmware decision win comingpackge bill offlin
video,tume take landmark veryyyyy gearth sm photo drawback ghos
iit,enter play g1 versatility cardiotrainer resent ct user makeover plethor
install,pitty updating failure signet download froyo signend signature package reupload topo q trophy sign bravoandroid dumb ware messager fails signing gus paclage anger security qa lisence reinstall wont bravo cant market guys thats installation say agnes aug error mo msg desire message cod
none,cmon guys figur
potential,ton zephyrpolarlike bluetooth person promise counter h7 refer addidas sensor shame hrm hoo
tour,city take bus second photos fetch shoot cycle granularit
hang,measurement application fan fire trekker slo
pinpoint,niw atleast hitting locates fetch locate forever
speed,minmax duration incorrect scooter news witth ex mih rebound evrage max trademill distance fox increase kmh bikers dependent average avg milage categoriz
broken,dell cry force venue nexus4 tho pos dependent junk clos
sportypal,duration interacts performance myfitnesspal seat sort resume pause feel wider restar
glo,ton wireless meant ant zephyrpolarlike colorado support bluetooth conjunction wearlink speedcadance finer foothill h7 refer fitbit reference health hrms noisy sensor ie garmin runhike toppeak zephyr hxm hrm panobik
jungle,network stage effect way mining data race constrains hence connectio
needs,limit tidy hv schem
walking,mtn transport halfwa
interaction,wonderful doc rock gimp cake fly juncky interacts ease tnx jst neats docgreat dropbox earth appsgoogle feel wit addition mapchartstats playback image browse replay mapsna
trekker,application touch concept idol mini buttonoption matias hang bloody alcatel nic
shp,arcgis uploads adobe wonder convert lightroom kmz kml complain converter format thirdparty mytrack softwar
m8,razer idol mini wreck dashboard fc m7 ic alcatel happens troubl
selection,kmshr gpxkml shd allow outdoor toimportexpor
reputation,stature poalr tech pls zephr be
technology,feel handle yea
dependent,witth force nexus4 thumbsup speed broken stall milage clos
note,s3 ace i9003 tatoo galaxy shouldnt satnav q mini samsung captivate scl sii samsumg matias pad2 i8150 s4 i9082 player kit offse
author,plan version issuesissues vgood favor future constrains receive
minkm,stutter frequency therefore reporting delay band split feedback voic
slow,wife cruise sooo hang bloat
let,choose find outdoors destination clue face tourist detect
english,textfacebook email kmshr raja lightweight tnx saudi something lighter share grrrrr
odometer,plot stops walk challenge ca
weight,rucksack varies spent include coach v02max caloires smarttracker etc insert calculate delay burn calorie input hrmax extra reflect gender malefemale eg height ag
repeat,kerenls circle pattern neighbour measure rubbish length sound combination loop spb stree
ui,holo stutter smoother disappear efficient limit development versatility dark experience interface capability name tidy simple simpleuser multitude matias user makeover expiry lap scheme fc
excursion,mode airdroid counterpart save cop
timer,ypu reception spb alarm chunk are
dy,craziness footpath reception graph pointer screenhow nit show park are
shame,yes waste duty dnt cellphone kilometershr stage foreground promise hungry addidas potential keepe
airplane,trackin mode iphone counterpart sure bos restart towe
log,cycling community choose le
follow,ideal sooooo truck owner fly synchronize friend treck cooool route dropbox earth availabla retrace complite plethora repla
twenty,minute majority driving min perio
lap,disappear label style remain timing ui custom haven
trackpath,vision frequency ex therefore segment drop distance fox challenge ie lead goal categoriz
i9082,s3 ace i9003 tatoo galaxy guy satnav q mini galax exllent samsung bummer captivate speedcadance scl lll screenhow sii samsumg s2 pad2 ii s5 s4 note player backyard kind
increment,prompt prefer sound turn recommendation reporting accessory announcement invest cue voic
win,ability frequency mytracks nature pass treating googlemapway eror article lol comingpackge bill voic
c,f oops sorry need b bow spyware explanation jerk pirateware dashboard placeme read invasive privilege explain logger buttonoption overreach announce routine access loc call contact dobt bitch collection comm permission googlebots calenda
enjoyment,flight prediction photos fashion geo halfway camp shut apri
glitch,remark advice slide enlarg
bookkeeping,circle crazy randomly runkeeperendomondo hearth loop picture doublebacks information campu
hrmax,rucksack varies spent include coach v02max caloires etc counter insert calculate delay burn calorie weight extra reflect gender malefemale eg height frame ag
fusion,uploads attempts ease sheet merge week table docs upload syncs choice spread sen
moving,waste checkpoint accord gate abscissa driving nyou move pause flakey brief total min appsgoogle clock time reader movie non timespeed readout compute i74
ie,garman meant zephyrpolarlike calender colorado bluetooth wearlink speedcadance finer foothill h7 refer reference hrms sensor glo trackpath somebody toppeak zephyr hxm hrm panobike categoriz
bloaty,everytrail shouldnt crash effort slo
product,chu juncky adobe lightroom foreseeing magnitude miolink portfolio ptemiu
factory,directory tolerance airdroid ala backup reset mistaken copy forgo
morning,office synch precis
mobile,plan froyo roadtri
g525,wonderful cellphone disappointment wear ascend defy suck sucker trek android v
complite,treck kmz execution follo
camp,rucksack thousand use day flight journey enjoyment confirm shut april marke
reader,checkpoint accord gate abscissa seat neats nyou move flakey total appsgoogle clock time moving apis i74
fcc,item shouldnt wise intrusive star explain continuation overreach co
wearcarry,tangent device chrome priority browser type aggregate ladmarks tiein activity stat
razr,respond overhead maxx razer performer kitkat alert w slowdown winner fc droid motorola xt926 hd j
reliably,middle myocation recorder london initiate drawback tower limitatio
xellent,strava back verdoon thunderbol
bear,clearer sea con tool altitud
bore,redesignd l dony right exploratory gb simplicity design think dir
training,setup timedist analysis monitor rate runrest ship synchs heart monitoring split interval custom target compete zon
rode,talk penultimate mark ty bike lunch mile rider bicycle rid
bos,grandpa part performance mode iphone feel counterpart sure airplan
university,stillendomondo circle pattern neighbour crazy randomly neighbourhood baby house locatio stay floor loop pigeon doublebacks building fluctuates go haywire programmer campus but
distraction,intersection humidity temperature statistic kph novelty unlock maratho
lost,replacement tracksgone recognize maintain waze signal engage circonstances appal blame roadtrip opportunity wood l
tiein,bt359 device represent wearcarry sir
tree,
stall,try tatoo force crashing nexus4 reason reboots closing runningactivity moment dependent press closeit close fil
sm,take visualizer calender capture landmark camera tool geo geotag video photo synhronise eg marke
bias,respect mapmyride disappoint disappointing ridei i9000 ki
zoomout,chu desktophomepage dialogue confirmation harder click trackit milestone stop forget greati postworkout placement hit minimise risk push button fat press recording tap accident fil
i9000,magnitude mapmyride disappoint disappointing sourse bia
bozo,recommend scale otherwise release walker bicyclist runner wider bar manager kind hike
piece,group sum complain filter novelty information softwar
quad,minute note2 authentication continuation core maps featur
format,arcgis uploads wow csv adobe wonder convert lightroom accept export kmz kml timestamps send process converter gpx gis contain shp facility file thirdparty mytrack weblink software p
gmap,export title engin
loss,guesswork signal coach execution locates blame lea
wifi,vice network leave criterion router mes
site,beta web visit foreseeing lite visualization page statistic devs preview trasfer onlin
call,f list history sorry need bow accept spyware quit jerk pirateware intrusive read privilege explain logger invasion overreach routine u access loc c contact dobt bitch collection comm permission calendar identit
circuit,lose performance browser seat ons weekly wider exercis
sirf,bt359 device jan tiein recordin
connection,imp network stage effect loses micromax cell logging networks connectivity a88 data internet jungle availability are
period,wold unistalling delay twenty extr
competitor,criticism response cellphone lobe bullshit consumes mm paul neat yeh thin
vr,b520 wear ascend tablet v222 hmpf jellybean defy android hours g525 motorola xt926 baseband stoc
reality,trip correlation army drunk spb meter kayaker knife registe
forword,gus yay look slaughter calculationstat toimportexpor
please,library otg fuction dosent add autopause addons speedposition gmaps chromecast whats teeks attention iuse sail asap platform kit camnot fix magnus knot identity acknowledg
tourist,play fall wherehow face le
summary,minmile tracksgone lose hrmile tab title axis appal ideas char
disappears,york intrusive read loc com
lol,ability osmand smarttracker pre discipline worldwide segment input challenge win goal allows maratho
integration,doc wear beklutzye abscissa integrate sync docgreat google mapsna
glass,item day wise sta
compass,amazing integrat acro barometer accelerometer rotatio
ya,navihation mile
hugh,value difference apps range decision 
doesnt,signet signend package topo store display wont agnes messag
issue,lightroom patchy thrice g1 venue issuesissues resent n
gain,guesswork elevation canwe validate altimeter info si indicator inch sea grade ft foot bug figure altitude stat month speedon comput
amaze,juncky addons avid earth mapping consider repla
motivation,footpath sum exploratory beginnin
chunk,trip spb kayaker timer kaya
case,men mount sdcardmytracksgpx sdcardgpslogger hmpf shortcut heiner command newdir brilliant everest ran bind execute busybox whitney annoy till win
travel,mod mistake vehicle company yay witness vacation trek meter register journa
photo,remedygoogle beklutzye visualizer generate calender capture landmark camera variety intergrate tool geo geotag video sm synhronise bunch allows marke
buff,wold observation thumbsup ty burnt imo body practice composition metabolism calorie fitnes
fh,measure need installs pedometer gre
drawback,search tume guy take cent veryyyyy ehh hitting worthy fetch hidden video reliably satellite locat
novelty,chrome compare group sum statistic type filter distraction piece activity information stat
versa,vice understand nt punch lightweight shuts whatsapp inconvenience navihation hv employe
chart,minmile frustrating zoom hrmile swipe browser interest traffic graph tab right title axis scroll landscape pain summary n slide stat
xperia,dnt acro usefulness sony bod stability ideas sourse zl identit
commute,penultimate bike wheelchair night bicycle rid
calculation,pursuit wold ty acre count accelerometer runnn
garmin,meant zephyrpolarlike bluetooth conjunction wearlink speedcadance foothill refer fitbit sensor glo rider hr
couch,grandpa yesterday eyeroll second hour seat sit desk left chair workday kmph draw capacit
extra,rucksack varies spent include coach v02max caloires smarttracker burnt insert calculate calorie weight hrmax period runnng reflect gender malefemale height fram
fat,prevent desktophomepage dialogue confirmation harder trackit stop forget shortcut motorcycle placement hit minimise risk button zoomout press acciden
stat,elevation info begin gai
get,verge raja garman shuts wait faulty mihr roadtrip flui
bother,contactsy penultimate bike night motorbike rider rid
mapping,ordnance teapoy maverick survey amaze consider inaccurat
freeze,trip miscalculate trackstill resembles froz
brilliant,favorite mount sdcardmytracksgpx sdcardgpslogger heiner wheelchair command deletion newdir case bind execute busybox whitney anno
re,pitty fiximg trail hike shorelin
solve,signet signend package cmon signing reload timestamps lisence wont ideas guys asap installation file camno
wit,interacts beklutzye intergrate interaction posibillit
accomplishment,group sense agood flexibility definition kid giv
muti,crazy angle round w route run loop square doublebacks availabla acuracy challenge deflectio
portfolio,chu juncky magnitude fan synch operation produc
neat,presentation doubt drainer postworkout revisit left sure competito
coz,privacy star continuation hurry fcc malaysia giv
droid,overhead sentence maxx razer performer b520 kitkat v222 w slowdown fc defy cm101 ic moto razr motorola xt926 hd x stock stream j
recognise,appalling join nt goole cent worth powerhouse hidden markerswaypoint
yeh,eyeroll north hour imho right xperiau desk left consumes superman competitor flame yea
tracking,appalling hidden mylocatio
garbage,ft e
sunday,gplay shelf yesterday privacy mytracks pass hole mining workout invasion data mountain race miner maps ghost storage reconnect
death,extent wan letter hibernates curiosity avoid reboot lag becomes flick cause brokenwill ginger bold home eats launcher zl myvtrcks screen widget lock difficult
navigation,shoulder odd stamp latitude wth availabl
elapse,checkpoint goole majority stamp layer integrat sheet jst inbuilt upload synch spread mind grey resync ghost mapsna
synhronise,visualizer annotation crashing calender record quits landmark camera tool geo sm photo marker inconvenien
roller,sometime gpxkml wreck autopause chromecast discipline nothing iuse glitchy playback toimportexport coaster weeken
want,rocket bow navihation overreach scientist parent kid permissio
everest,mount sdcardmytracksgpx sdcardgpslogger command foot newdir case ran bind execute busybox whitney win
processor,duty heat accord battery usefulness life run timebattery generation kill zap generate
forgets,perfect authentication stage space otherwise wildland parent firefighter fori
date,ownthis therefore restart timespeed readout categoriz
ran,mount sdcardmytracksgpx sdcardgpslogger command workday deletion newdir case everest bind execute busybox whitney win
player,s3 i9003 galaxy search satnav mini prompt samsung captivate sound scl reporting samsumg music matias ii s4 note i9082 voic
markerswaypoints,appalling join nt goole punch featuresdoes shuts inconvenience gearth imagine navihation profile seperate mind figure shite employee recognise comput
garden,waypoints footpath side line walk coffee road motor pirateware instruction paste zag fron
fluid,endomondo line agood definition ge
cuz,version map pos engine stuff home mapsna
programmer,speedometer dot neighbourhood backwards sort hope asks floor elivation drawn job fluctuates go happrns university selects but
contact,f oops list history sorry need privacy bow accept spyware quit grate jerk pirateware placeme intrusive read invasive privilege grab explain logger invasion overreach routine access loc c call dobt bitch collection comm permission calendar skip identit
broadcom,provider device card priority directory test chip memory backup sd recording sprin
note3,shouldnt dnt heat sleep battery charger hour consume usefulness life usage unistalling generation kill zl standb
comingpackge,topo mytracks nature complet ware treating eror vs firmware article win bil
platform,provider mock library provocation overlay chipset atleast asap quality please magnus acknowledg
runnng,gsensor spent spyware wold observation cruise caloires ty reason burnt counter spentthe insert calculate practice burn accelerometer calorie calculation extra gende
lame,round timebattery landscape cygi
start,perspective confirmation trackit milestone stop label record synthesis closing startpoint push button googlemap warmu
average,incorrect scooter witth rebound evrage term max kmh speed avg l
