 Noun,Adjectives and Verbs
revisit,pick reboot sit desk left drift chair nea
gmail,inception psw issuesissues character thr
witness,member pocket vehicle conference company abandon regard dev asker travel requirement team tall api
ask,proper manage play jerk installs grab bloatware question access dobt bitch permissio
request,continuation toppeak kilometr
break,canwe pos issuesissue
placement,chu desktophomepage dialogue confirmation traffic harder trackit milestone activate stop record resume forget shortcut nyou closing greati hit p500 minimise push button zoomout fat press restart recording detects accident squa
pabna,hopeless cross radio offroad sort situation chanel arg pointless country secession bd f
preview,link notice fb aspect web visit foreseeing lite visualization page statistic state jumping engine devs sit
ongoing,problem eye sportstracker installg tho
left,eyeroll north tab right unistalling sit desk scroll revisit drift pain draw superman couch neat yeh capacity yea
speaking,minute yesterda
tip,sdcardmytracks alwaays shd export exportsimports kmlgpx import gpslogger clumsy train gpx folder isn
startpoint,navigate nexus4 tell push start googlema
continuation,item note2 wise star rating request core hurry lawyer fcc quad coz malaysia give coolest clou
stuff,neats cu
prevents,mock motox resent favor use
ct,enter priority versatility experience cardiotrainer resent task user makeover ii
ad,horse endurance sharing tidy option itwe plethora scheme boatie
rambler,discrepancy navigate walk motor instruction ladmarks wile bus
hit,snowshoe chu desktophomepage dialogue confirmation harder trackit milestone stop resume forget pause closing greati placement minimise risk push button zoomout fat press restart recording detects acciden
firmado,hasbeen programme esta messager lg correctamente el optimus miscalculation error g
water,benefit fuction dosent inbuilt purpose task usability plethora motionx functionality business ios blo
simple,holo configure quite kmshr math lightweight super interface name tidy prediction appal multitude design hours expiry ui schem
prediction,tracksgone quite kmshr light movement cumbersome super improovments good fancy simple enjoyment gu
appsgoogle,checkpoint interacts gate abscissa neats nyou move clock interaction moving reader api
example,today le
command,favorite men mount sdcardmytracksgpx expert sdcardgpslogger shortcut heiner deletion newdir case brilliant everest ran bind execute busybox whitney annoy win
photos,location motox fast movement sharingdirection geo match shoot tour enjoyment positio
world,stops sum p pace routin
wont,updating signet download signature package sign dumb ware messager signing paclage qa lisence reinstall asap install doesnt solve say camnot error msg pity messag
ok,i9003 tatoo v222 cardiotrainer jellybean scl r march defy yay moto than
appal,minmile tracksgone mapdata kmshr hrmile limit interface axis name tidy simple lost summary scheme opportunit
australia,change unit monitor bpm matric quirk obstruction rate ship kilojoules stopper synchs heart metre preference monitoring energy smart kilometre zone preet
idk,simpler alwaays verdoon favourite think pi
con,consolidate clearer runkeeperendomondo myocation bear lightsmall functio
refer,ton meant ant lack zephyrpolarlike colorado bluetooth whereas wearlink speedcadance finer foothill h7 gramin reference hrms sensor potential glo ie garmin runhike toppeak zephyr hxm hrm panobik
calculate,spent observation v02max caloires ty calculator burnt counter spentthe boooo algorithm insert lunch hm burn accelerometer calorie weight hrmax extra runnng gender malefemale estimate height fram
wish,googlechrome turn tonlovester marke
samsumg,s3 ace i9003 tatoo galaxy guy satnav q exllent samsung bummer captivate scl lll screenhow sii s2 pad2 hey ii s5 s4 note i9082 player kind
china,appalling trust geology detection recorder transport z1 stand mind halfway offset gre
afterwards,town niw pointer look vacation show listit journa
locates,pinpoint loss forever
feel,interacts streetview performance endonondo pass ons boost weakness sportypal interaction technology bos cygi
look,slicker redesignd perspective pigeon afterwards vacation slaughter forword journa
overreach,oops history sorry need privacy bow accept assume spyware pristine grate jerk pirateware frustration intrusive read invasive privilege grab explain logger routine consistency access clog loc c fcc call want contact dobt bitch collection comm permission calenda
a88,stage effect micromax networks connectivity data music internet connection reconnect
cm101,maxx duty razer kitkat fc wkit brand eater nexus droid stoc
longitude,csv latitude reading giv
correctamente,programme esta summer messager lg firmado el optimus miscalculation g
direction,road mine backyar
vacation,slicker eye take pigeon afterwards look travel journa
drawn,speedometer backwards path seldom fluctuates go programme
eater,toggle dnt heat hog razer power batter battery onthefly consume usefulness life usage chew cpu suck cm101 drain kill wapp sucker zap consumes eats zl eat killer drainag
feb2014,use resume usage transport buggy winter halfway proces
backup,measurement provider card htc directory chip memory sd reset factory broadcom copy sprin
nit,d
drain,toggle kept heat sits hog imp power battery background kilometershr onthefly drink consume usefulness life chew hungry generation eater kill wapp sucker zap eats zl interesting killer drainag
profile,twitter text lightweight shuts care medium share markerswaypoints facebook imag
service,gplay tunein radio play cell chanel networks verizon planet bloatware internet f
scientist,perfect fast rocket walker wildland bicyclist runner mention parent firefighter want kid forit hiker fac
stability,gps instance lose waze meaningless signal acro loses barometer execution blame noisy xperia magnus antenn
sd,provider transfer card directory beginner expert chip creates focus abandon memory backup tracksfiles broadcom folder copy sprin
doublebacks,snowshoe size stillendomondo circle pattern neighbour crazy jump randomly house locatio stay loop square bookkeeping university muti campus skip butt corrup
agood,recommend line wise bridleways definition accomplishment fluid give timespee
tracksfiles,computer card discontinuity count sd wildfire folde
fetch,search tume take veryyyyy tick ehh hitting geo hence tour pinpoint drawback locat
hm,cake observation ty counter calculate calorie zephyr nic
office,breath speaker sound assistant announcement doctor mornin
synchronization,mapsnavigator capture synch addition functionality browse mapsna
parent,perfect speedometer rocket wife walker corrects wildland runner asks check acre scientist firefighter fire fluctuates want forgets kid forit hike
weekly,streetview browser interest statistic state provide europe circuit cygi
runningactivity,instance nexus4 wreck mapmyfitness satelites stall throw forever
kill,toggle dnt heat hog battery kilometershr avoid drink consume usefulness life chew cpu hungry generation eater drain wapp sucker zap generates processor note3 zl eat killer boaties drainage standb
isue,stillendomondo place mark number spot im hunt scout pi
ideas,acro kml timestamps sony plug bod summary xperia solve file folder isnt p
auto,bomb ant speedposition connect hi pausestart gramin addidas strap detects hr
landscape,zoom swipe traffic icon mode graph report tab display scroll empty chart lame n slide listi
bridleways,tangent goole mountians print trail wilderness hello agood topography sho
percent,malfunctioning fault lag cause plug home difficult
practice,everyone visualization wold observation ty idea io person burnt imo spentthe calorie buff runnng spor
clock,window accord couple gate pick resume tick nyou move pause flakey brief total min appsgoogle time youngster moving reader non happen
bullshit,response otherwise love flaw recorder chair fall kmph simplicity haywire competitor coaster weeken
favourite,snag frustrate feetmiles alwaays improovments boater verdoon trackstill exploratory idk gee pity bus
discipline,ability reviewer browser autopause miss lol roller sport activit
gb,redesignd eyeroll north beta thanx right xperiau utility scroll trasfer simplicity superman bore grey rotation yea
announce,f sorry quit placeme routine mihr c googlebots calendar everythin
ic,maxx razer idol success fc cannt operation m8 droid alcatel coolest v moan cod
z1,txt wilderness transport china halfway til
attention,freebut developer gmaps teeks cannt iuse asap tge please camnot fix magnus acknowledg
announcement,breath speaker sound assistant office doctor incremen
drift,traffic right spot im revisit left pu
fashion,location regain frustrate annotation logging googlemaps sharingdirection geo shite begreat loc enjoyment approach dir
delay,second smarttracker nebraska minkm weight hrmax period e
description,understand odd inconvenience spreadsheet min
worldwide,inception globe mock osmand lol coverag
chair,pattern neighbour yesterday dot crazy neighbourhood house sit desk revisit bullshit fall kmph draw haywire couc
setting,tolerance default al
nothing,converter roller coaster weeken
iuse,library dnt sometime dosent cooool autopause speedposition boater gmaps chromecast whats teeks pls attention asap please roller camnot fix magnus acknowledg
confusion,thx tho altitud
n4,remedygoogle problem notice anyone edit patchy calender faulty state jw issu
n986,streetview dont thanx integrat integrate fuction provide anger teeks inbuilt asapzte cannt wth rotation offline mapsnav cygi
fitbit,meant myfitnesspal health s5 glo garmi
simpleuser,holo consolidate ness versatility dark design makeover match u
worthless,correlation satelites a
kilojoules,mph gsensor thankx change unit matric quirk imo australia cal metr
blame,gps maintain waze signal engage loses atleast grrrrr sense stability drop lost loss lead antenna receive
job,music programmer quic
core,note2 authentication continuation quad featur
foot,pod number sea kilometer metre meter altitude gain everest level kilometr
time,waste checkpoint accord gate end stamp reverse complet driving nyou move flakey total clock vs moving reader movie resync readout i74
composition,everyone imo advice body metabolism colour buf
host,twitter otg winner retrace trailerror facility thr
gramin,otg ant zephyrpolarlike addons bluetooth wearlink connect h7 refer auto addidas strap hrm thr
communication,poorapplication developer perspective money channel summer customer fan synthesis redesign july storag
invest,anyone flaw accessory increment documentatio
workday,consumption hour usefulness half unistalling desk couch ran capacit
segment,therefore drop challenge trackpath lol lead goal categoriz
desktop,chrome browser googlechrome view analyze aggregate gis unloc
router,mih leave si criterion speedpace mess wif
advantage,
camands,better simpler runkeeper crapware precis
ux,tracksgone poorapplication channel mapmyrun idea good mechanism synthesis execution redesig
youngster,gate poalr movement trackstill clock zephr be
dev,notice project member web foreseeing page pocket state conference devs abandon regard witness asker requirement tea
handle,technolog
vs,runkeeper complet eror total time motorbike comingpackge i74
wider,minmax duration interacts scale performance myfitnesspal seat walker ons bicyclist s5 sportypal bozo circuit goal hike
greatoilfeild,better back driver bounce verdoon shot someone introduce switch tanke
doctor,breath speaker sound assistant office announcemen
event,ty perso
addidas,connect auto gramin strap potential shame hr
wapp,blah simpler heat hog version battery usefulness life cpu eater drain kill zap eats zl kille
mapmyxxxx,imho apps grade buggy suggestion bug decision fring
fall,response yesterday txt today bullshit chair kmph haywire tourist coaste
kmph,response yesterday eyeroll sit desk bullshit chair fall wherehow haywire couch coaster yea
data,gplay presentation shelf imp luck pass effect beginner hole connectivity mining agreement a88 mountain race constrains miner jungle connection sunday collection storage corrupt reconnect
moment,tunein radio setup force milestone chanel reboots closing push button stall press fm close fil
par,runne
fail,signet package sign fails bummer agnes kind
order,magnitude improovment
injects,kept giant verge jump random gap useless loop amount pack wood inaccurate outpu
winter,use resume usage buggy feb2014 proces
year,game millisecond soccer rubbish inconvenience inability compatibilaty workout snowboard weakness os field technology maps month inclusio
music,tunein radio prompt sound reporting inspiration a88 job player online voic
bar,indication scale rocket notification walker bicyclist runner status bozo manager hike
firefighter,perfect speedometer majority authentication rocket luklckaly wildland runner asks pay acre scientist parent fire fluctuates forgets forit hiker froze api
gpslogger,csv sdcardmytracks shd export menu kmlgpx import tip gpx folder isnt pc inconvenien
stand,china gpsr afoot ca
air,garman include faulty pressure everythin
drop,gps signal sense backpack blame segment trackpath coverage lea
miolink,alpha connects support bluetooth monitor bpm connect rate ship h7 compatibility strap synchs mio heart quality monitoring energy product cadence smart hrm target zone preet
multitude,holo stutter kmshr lightweight development versatility interface capability name tidy simple makeover match expiry share ui scheme fc
p500,dialogue confirmation trackit tablet stop lg malfunction placement push button press loc
counterpart,goodness trackin mode iphone sure excursion airplane bo
secession,hopeless cross radio offroad sort situation chanel arg pointless country pabna bd f
beige,dont fir tab m
bridge,truck reverse click differ road route buttonoption availabla acurac
sucker,toggle dnt hog imp cellphone power batter battery kilometershr love consume usefulness life drainer chew hungry eater drain kill zap consumes g525 zl eat interesting kille
max,elevation incorrect math news mih rebound grade evrage lunch speedpace speed average avg maximu
mountain,presentation beginner expert biking mining data miner bikers sunday maps storage reconnect
el,hasbeen programme esta trophy treck messager teleport firmado correctamente miscalculation garbage agnes error cod
question,mih reply ask speedpac
clumsy,choose csv transfer computer sdcardmytracks export exportsimports plug kmlgpx import tip send gpx file folder isnt p
trek,wantneed frustrate vehicle wherever company exploratory g525 trave
option,ordnance humidity thicker tnx survey avail sharing ad initiate share trailerror plethora pic pressure grrrrrr boaties kno
hop,amazing weather believ
strap,otg ant bluetooth bpm connect h7 reinstall auto gramin addidas miolink heart hrm thru preet
bravo,froyo package htc dumb messager gus paclage installation install agnes error desire cod
comment,email repl
aggregate,chrome luck browser sum visualization analyze outdoor desktop ladmarks wearcarry activity stats fram
pace,vision therefore world colou
cant,signet spent signing manipulate caloires vgood instal
ginger,extent wan frustrating curiosity mean blank lag gingerbread becomes flick cause scroll startup pain home death screen widget loc
future,plan simpler problem version haaaaay vgood favor author revert installg mytrac
market,play installs mind instal
spb,trip army length count resembles repeat timer reality chunk kayak correct knif
matias,s3 galaxy touch idol mini samsung scl trekker note ui player bi
mile,discrepancy hour half sec hint rod
android,i9003 b520 wear member ascend poalr galax pocket v222 hmpf jellybean scl conference defy asker g525 vr motorola team zephr xt926 baseband stoc
cal,thankx unit imo kilojoule
routine,f sorry bow spent quit read explain world overreach announce access c call contact dobt bitch permission googlebots calendar everythin
upgrade,altimeter thrice inconvenience resent os characte
bug,guesswork elevation developer altimeter sloppy teeks remain inch grade mapmyxxxx gain thank
mihr,garman announce article get till everything mile
topography,interacts cache enhance streetview map mountians endonondo layer interest print oof landmark trail moreorless hello wth append bridleways colour offline defeat cygi
fire,perfect speedometer majority bulldozer luklckaly wife wildland asks acre parent firefighter fluctuates hang kid fori
synch,punch juncky attempts interacts drive mapsnavigator sheet jst docgreat dropbox syncs buttonoption synchronization spread mind employee morning portfolio elapse resync browse mapmake
startup,meaningless ginger afterward io
offer,signet package avoid ware signing lag anger qa reinstall agnes loc
asker,wear member ascend pocket vehicle conference company abandon regard witness dev android requirement team tall fron
metabolism,everyone imo advice body composition buf
lighter,perfect myfitnesspal asks something englis
s2,ace i9003 tatoo galaxy galax exllent samsung bummer captivate speedcadance scl wtf sii samsumg pad2 s4 i9082 mikm backyard kind
ruin,appreciate dnt usefulness monitor hungry monitoring zone preet
alarm,ypu miscalculate i8150 time
user,enter priority background development versatility dark experience cardiotrainer resent task prevents ct usability makeover iit ui plethora n listit select
zap,duty heat sits hog power battery background kilometershr uninstall control consume usefulness life chew run eater drain kill wapp sucker processor boo
redesign,respond sometime poorapplication perspective channel customer lag recorder mechanism synthesis smartphone execution communication ux gee halt grin
shot,driver luklckaly greatoilfeild tanke
exit,gate reverse connects differ nyou consumes zon
weakness,feel year map
someone,driver varies tell greatoilfeild rute tanke
thought,wt
choice,reviewer odd table docs fusion sport tracker feedbac
optimus,everytrail esta sign nature mapmyrun action lg firmado correctamente load decision launcher myvtrcks g2 
trasfer,grandpa beta layer web lite page xperiau jumping devs hello gb sit
reading,stamp gradient waypoint longitude ridden precis
introduce,back reverts application layer rubbish right greatoilfeil
availabla,tracksgone truck fly reverse return india route bridge follow muti navigation deflection spike delh
kilometer,unit matric foot metre meter kilometre kno
minimise,chu desktophomepage dialogue confirmation harder action stick placement hit risk button zoomout fat press launcher acciden
range,craziness value difference result hug
os,inconvenience week year upgrade mont
spread,longer synchronize attempts abscissa drive tnx sheet sync backlog docgreat docs upload syncs synch illinois fusion elapse resync brows
u,quit call dobt bitch calendar identit
pad2,ace i9003 tatoo galaxy crash q suxit galax exllent samsung bummer captivate scl sii samsumg s2 ii s4 note i908
hidden,appalling cent myocation powerhouse represent noise filter drawback recognise trackin
guys,signet explorer signend package cmon sign ware qa lisence thats installation install none solve file agne
flexibility,sense accomplishment tracker give competenc
gpsr,unit stand kmh wil
seperate,appalling amazing correlation gimp treadmill punch render competition outdoors atv frustration imagine installs mind consistency shite markerswaypoints grey believe april stepper dirt sgs
modifies,k
stopper,measurement measure change unit system matric quirk australia measurments preference mikm delh
hurry,item wise monitor star rate rating h7 continuation synchs coz malaysia target coolest h
synchs,appreciate alpha connects monitor bpm obstruction rate pls ship compatibility australia miolink hurry mio heart monitoring energy training cadence smart target zone preet
didnt,realize txt today onlin
amount,random injects kayak burner output corrup
deletion,favorite sdcardmytracksgpx sdcardgpslogger sportstracker command newdir entry brilliant ran bind execute busybox anno
simplicity,wonderful redesignd l cake dony annotation rezound otherwise flaw xperiau utility wth bullshit gb handy bore calculationstat gre
mind,appalling understand trust punch interacts endonondo hardcore atv fault head represent recorder installs fan root hv china description market synch seperate consistency employee elapse markerswaypoints gre
po,speedometer lot updates asks fluctuates g
risk,chu desktophomepage dialogue confirmation harder action stick hit minimise button zoomout fat press launcher acciden
london,find mean middle myocation wtf reliably mate function gfaceboo
glitchy,pilot autopause miss twio gearth sharing roller functionality featur
moto,k kitkat din hmpf graph jellybean defy ok droid xt926 x clos
burn,gsensor spent wold half v02max caloires ty burnt unistalling boooo insert generation calculate accelerometer calorie calaries weight hrmax runnng gender malefemale height burne
race,mytracks pass hi mining workout data miner jungle sunday ghost storag
definition,recommend line wise agood accomplishment fluid kid give timespee
save,multiple excursio
usability,fuction inbuilt timestamps task water user makeover plethora motionx guid
operation,eye wreck spreadsheet cannt ic portfoli
wherehow,fast play kmph tourist coaster weeken
hey,learn guy lll connectivity screenhow samsumg i
consumes,ton power battery differ usefulness fc eater sucker exit competitor yeh zl kille
everytime,checkpoint snag stamp frustrate po
acuracy,ideal truck fly synchronize fir whilst route motor bridge begreat cycle muti deflection par
newdir,men mount sdcardmytracksgpx expert sdcardgpslogger heiner command deletion case brilliant everest ran bind execute busybox whitney annoy win
trademill,indication scooter ex zero infuse min fox kmh speed av
pain,frustrating north swipe tab right check scroll left ginger char
status,failure signet package topo notification fails qa sent bar thats installation say feedback messag
wildfire,giant second htc discontinuity tracksfiles compet
building,neighbour randomly road floor pigeon course ground university tall stree
design,holo configure concept ness simple simpleuser bore scheme nic
ii,ace i9003 tatoo galaxy satnav q mini success exllent samsung captivate scl samsumg pad2 hey s4 i9082 playe
course,sentence turn word building campus strea
distance,incorrect ex maverick miscalculate therefore fox increase encourage bikers speed trackpath shorelin
thats,updating failure signet signend package topo sign complet ware gus got qa guys status installation install agnes error messag
weather,humidity temperature condition insert ho
reference,bomb ideal wireless meant lack zephyrpolarlike colorado bluetooth wearlink foothill h7 refer hrms sensor glo ie runhike zephyr hx
gnex,notification wkit exportsimports nexus mapmywal
night,weekyear gdocs penultimate bike asks motorbike commute bother rider bicycle rid
fox,incorrect indication ex therefore meh evrage trademill distance increase encourage bikers speed trackpath information give timespeed categoriz
accelerometer,pursuit caloires burnt barometer counter spentthe insert count calculate burn calorie compass calculation runnng counting gender estimate heigh
send,wow transfer sdcardmytracks sheet analysis export kmz kml docs upload kmlgpx import clumsy gpx fusion format facilit
figure,elevation altimeter shuts inch grade none gain markerswaypoint
sail,pod bt overlay micromax boater matric metre please motionx weblink magnus kilometre knot acknowledg
illinois,mph discrepancy walk p spread halfway motion wil
sooo,guy veryyyyy hitting slow speedplz milag
pt,refuse game trust primary htc mileston
sourse,meaningless satnav droppin chipset acro loses sony noisy i9000 xperia bloody adjustment antenn
health,pursuit bluetooth speedcadance finer fitbit sensor s4 glo hrm panobik
speedpace,mpr mih rebound router max question informatio
section,dell line jog venue detection calaries zag zi
tool,clearer visualizer generate geotag bear sm photo synhronise lightsmal
fluctuates,perfect speedometer lot backwards wife wildland asks floor drawn parent firefighter fire po go university programmer fori
consistency,correlation treadmill thanx spyware atv jerk frustration installs utility wth overreach seperate mind shite clog grey towe
makeover,holo enter stutter background efficient limit development versatility dark experience cardiotrainer york resent task name ct simpleuser multitude user usability expiry iit ui plethora scheme fck select
calorie,pursuit gsensor spent observation wife v02max cruise caloires ty person whereas burnt imo counter spentthe boooo insert lunch count calculate hm practice burn accelerometer weight hrmax buff extra runnng gender malefemale estimate height frame burner warmu
increase,ex therefore meh distance fox bikers spee
push,primary dialogue confirmation print harder trackit milestone stop record forget closing placement startpoint hit moment p500 button zoomout start press recording accident googlemap warmup fil
mess,leave si criterion biking router easytouse wifi movi
hours,lightweight asks something simple vr baseband motio
character,text altimeter remain gmail upgrad
step,whats pedometer counting burne
pedometer,appreciate gsensor integrate monitor obstruction step monitoring fh dobt cloud zone preet
remove,oops intrusive invasive explain permissio
hrms,understand ton meant lack zephyrpolarlike colorado support bluetooth wearlink speedcadance finer foothill h7 refer reference sensor glo ie runhike toppeak zephyr hxm hrm panobike hoo
button,chu prevent desktophomepage dialogue confirmation harder click trackit milestone stop record resume action forget shortcut pause closing greati placement hit moment p500 minimise risk push zoomout fat start press recording accident fil
