 Noun,Adjectives and Verbs
loses,gps indication satnav signal wreck teleport worthy stability blame sourse connection lea
dumb,updating failure froyo signature package esta trophy sign locus ware messager fails paclage avail qa wont bravo slaughter installation install say agnes error desire messag
day,rucksack thousand journey sky exercise camp glass confirm shu
si,elevation canwe validate altimeter criterion detection inch grade router mess gain calculationstat mont
control,stutter frequency efficient logger inspiration zap voic
nexus4,dell lose countryside force venue atleast closing startpoint runningactivity broken dependent stall press close fil
suxit,simpler snag version haaaaay pos issuesissues jan invasive pad2 pit
wise,scale view star rating continuation agood hurry definition lawyer fcc glass satellit
niw,town block thankx cut atleast wander kcal afterwards pinpoint show satellite listit forever
seat,cake window performance myfitnesspal sit root wider s5 draw timing sportypal reader circuit couch custom readou
bounce,back disappear respect grrrrr tonlovester greatoilfeil
hardcore,better gimp punch integrat head fan mind decision employe
milestone,refuse dialogue confirmation harder trackit stop record forget closing placement hit moment pt push button zoomout start press recording warmup fil
include,rucksack v02max smarttracker air weight hrmax extra reflect gender malefemale height maratho
goto,summer synthesis locat
change,measurement back measure unit system liaise default compatibilaty indicator quirk snowboard australia kilojoules stopper preference mik
ware,updating failure signet download signend signature package reupload topo sign complet dumb gus paclage driving reload qa eror lisence wont offer guys thats installation install comingpackge say movie agnes error desire messag
inconvenience,vice join understand correlation trust nt punch render shuts corrects navihation description year upgrade os versa markerswaypoints jul
inacurate,hence locat
versatility,holo stutter efficient ness dark experience resent ct simpleuser multitude user makeover expiry iit ui schem
fun,lot ban
thumbsup,minmax layout dashboard dependent buff informatio
inability,millisecond developer year field maps inclusion maximu
activate,trackit venue atleast resume ehh hitting malfunction placemen
isevery,duration stop forget nyo
pristine,bomb hate spyware otherwise omission mapmyfitness pirateware frustration intrusive invasive overreach comm permissio
outdoors,correlation treadmill runbike find care satelites seperate clue le
dark,enter wonder charles background ness versatility ray task simpleuser user makeover ui plethora room fc
test,icon qa task broadco
explanation,buttonoption c blood
terrain,enhance mountians hello standar
holder,algorithm i74
blank,wan goole reception mean ginger scout home screen difficult
treck,place execution el follow complit
galax,back reverts i9003 galaxy ascend forth samsung captivate scl android s2 pad2 s4 i908
add,autopause speedposition chromecast facebooktwitter recommendation please feature kno
otherwise,advance wantneed scale pristine love omission bicyclist app bullshit simplicity bozo forget
love,routespls enhance itd otherwise flaw heiner awesome wheelchair app cool bullshit sucker dodg
pocket,member hand vehicle conference company abandon regard witness dev android asker requirement team tall front but
summer,presentation updates money channel goto monthweek correctamente communication july cooles
coach,rucksack better varies v02max caloires instruction insert input weight hrmax loss extra gender malefemale height ag
flight,geology malfunctioning pilot crashing nebraska halfway enjoyment camp student shu
beginner,card expert sd data mountain bikers storag
cumbersome,shouldnt enhancement frustrate super improovments informative notch fancy name prediction s5 freebee enjoy paul calculationstat bloody toimportexpor
grate,history spyware pirateware read overreach access loc contact dobt bitch collection comm permission closei
temperature,appreciate humidity statistic condition avail sharing kph recommendation weather trailerror distraction pressur
atleast,gps provocation waze nexus4 niw activate wait hitting malfunction blame pinpoint platform fil
respect,better harder bounce mapmyride disappoint disappointing pay bias believ
sync,toggle drive myfitnesspal sheet backlog wherever delete docgreat root spread integration resyn
exllent,ace i9003 tatoo galaxy samsung io captivate scl samsumg s2 pad2 ii s4 i908
analysis,horse wow endurance kml runrest send trainin
wife,perfect speedometer b520 observation cruise wildland ty asks counter parent fire fluctuates calorie slow opportunit
backlog,bulldozer sync docgreat spread trai
tablet,p500 home vr baseban
messager,pitty signet hasbeen programme package esta trophy sign dumb fails gus paclage qa firmado wont correctamente el bravo miscalculation installation install agnes aug error cod
atv,correlation treadmill render dony bravoandroid frustration navihation hunt seperate mind consistency shite july grey pity steppe
tho,thx thrice g1 confusion broke
length,trip stops walk spb repeat stree
mode,zoom cache map swipe icon oof moreorless display iphone landscape counterpart face excursion airplane bos offlin
consume,toggle dnt heat sits hog routespls power enhancement battery kilometershr dony usefulness life usage chew wheelchair hungry generation eater drain kill sucker zap note3 zl interesting kille
stop,dialogue confirmation traffic harder trackit milestone isevery record resume forget nyou pause closing greati placement hit p500 push button zoomout fat start discover press restart recording detects acciden
cooool,sooooo learn drive sort chromecast teeks docgreat iuse follow rute mapchartstats camnot brows
release,fiximg vgood favor qa boz
mistake,pitty travel au
label,point end disappear return style slope waypoint task lap start reflec
fails,signet package attempt trophy sign dumb messager gus qa fail status installation install agnes error milage messag
usefulness,toggle dnt heat sleep sits hog enhancement battery kilometershr consumption consume life hungry generation eater drain kill workday wapp sucker ruin zap consumes xperia processor note3 confirm zl killer drainage standb
life,textfacebook toggle dnt heat sits hog power battery background kilometershr drink consume usefulness usage chew cpu suck generation eater drain kill wapp sucker zap eats processor note3 zl eat killer drainag
statistic,humidity web lite page temperature state engine synthesis preview weekly distraction site novelty online unloc
address,mapdata email text corrects infuse chec
wait,atleast hmpf jellybean get forever
super,configure geology kmshr visualization light cumbersome improovments effort fancy utility name simple prediction blood
unit,measurement measure thankx india change system matric quirk australia kilojoules cal kilometer gpsr stopper metre preference mikm kilometre backyard knot delh
oof,globe enhance map mountians mode moreorless represent r hello wth topography colour rotation offline defeat mapsna
wreck,dont endonondo loses sportstracker docs cannt runningactivity operation m8 rolle
colorado,bomb meant zephyrpolarlike bluetooth trail wearlink speedcadance finer foothill h7 refer reference hrms sensor glo ie runhike toppeak zephyr hxm panobik
experience,enter whole development versatility cardiotrainer ct user makeover ui plethora guid
december,boos
walker,recommend perfect fast scale rocket wildland bicyclist runner reboots pay mention scientist parent wider bar bozo kid forit hike
record,refuse primary confirmation milestone stop shortcut closing placement push button synhronise start press trace milage warmup fil
autopause,add speedposition miss twio recommendation discipline iuse glitchy please roller thin
samsung,s3 ace i9003 tatoo galaxy satnav q din mini galax exllent bummer infuse captivate speedcadance scl sii samsumg matias s2 pad2 ii i8150 s4 note i9082 player backyar
capture,annotation generate synchronization geo sm phot
signing,pitty signet problem freebut signature package paclage anger security cannt lisence reinstall wont cant offer asap install solve camnot aug error msg desire messag
v222,maxx b520 kitkat ascend hmpf jellybean defy suck ok android vr droid motorola xt926 hd mo baseband stoc
corrects,nt ypu shuts inconvenience address apart navihation check parent anythin
support,bt wear raters web ant foreseeing lack zephyrpolarlike bluetooth speedcadance dropout devs foothill compatibility miolink hrms sensor energy glo id toppeak cadence hrm panobike hoo
gus,updating signet simpler froyo signend package reupload sign ware messager fails promise reload qa bravo thats installation install forword agnes error message cod
addons,library post otg ant chromecast winner gramin please amaze thanks thr
micromax,a88 sail connection magnus acknowledge reconnect
bluetooth,ton bt wireless meant ant lack zephyrpolarlike colorado support wearlink speedcadance finer foothill h7 compatibility refer gramin miolink strap reference health hrms heart sensor energy potential glo ie garmin runhike toppeak zephyr hxm cadence hrm panobike hoo
weird,
manipulate,geology shape crashing fexibility menu way form can
shd,priority gpxkml allow export import tip gpslogger train selection 
myocation,nt find featuresdoes waze mean middle powerhouse wtf con hidden london reliably mate functio
expert,mount card sdcardmytracksgpx beginner sdcardgpslogger command sd mountain newdir bikers bind folder execute busybox whitney win
drunk,reviewer couple jump kangaroo locatio teleport reality tracker calibrate registe
tolerance,appalling treadmill featuresdoes fine default powerhouse accuracy ala nope affect setting complain factory mylocatio
half,stops dog hour workday mile burn hint capacit
account,link ease collect sync
system,measurement measure change unit speaker matric quirk stopper metre preference mikm kilometre backyard delh
ons,performance browser chromecast facebooktwitter feel wider s5 circui
monitor,appreciate alpha connects party bpm obstruction rate ship h7 compatibility australia miolink ruin hurry synchs pedometer mio heart monitoring energy training cadence smart target zone preet
baby,snowshoe stillendomondo stroll take block locatio im loop university campus ski
sdcardgpslogger,favorite men mount sdcardmytracksgpx expert heiner command deletion newdir case brilliant everest ran bind execute busybox whitney annoy win
jerk,gplay management need bow hate thanx accept spyware pirateware frustration intrusive read installs invasive privilege grab explain logger memory ask overreach consistency access clog loc c call contact dobt bitch collection comm grey boot permissio
keep,provocation thankx itup flop kcal lead woo
adventure,truck bulldozer thicker offroad crashing road halfway happrns haywir
merge,attempts ease spreadsheet table upload fusio
quits,refuse mapdata email camera advice synhronise ta
maverick,teapoy somehow distance mapping estimate inaccurat
cardiotrainer,enter experience resent task runrest ct ok user makeover ii
v02max,rucksack varies spent include coach caloires etc counter insert calculate burn calorie weight hrmax extra reflect gender malefemale eg height frame ag
cruise,b520 observation wife ty counter spentthe lunch calorie slow runnn
criterion,lightweight si fit router mess easytouse wifi are
miscalculate,deal meh alarm distance resembles freeze froz
see,chrome browser post mention stat
landmark,take calender camera becomes topography video sm photo synhronise allows kinda marke
caloires,rucksack gsensor varies spent observation coach v02max ty burnt counter spentthe insert calculate cant burn accelerometer calorie weight hrmax extra runnng gender malefemale heigh
worth,appalling sign cent recognis
airdroid,kerenls raters dropout excursion factory cop
pos,pitty blah simpler version haaaaay suxit fexibility jan vgood engine favor break everytime broken cuz revert aug mo pity cod
hmpf,men wait v222 jellybean defy android moto vr case xt926 til
sort,hopeless offroad cooool arg root country pabna secession sportypal programmer b
mapmyrun,everytrail raters nature ux optimus load launcher myvtrck
paclage,updating failure signet download froyo programme signature package topo sign bravoandroid dumb ware messager signing reload qa wont bravo install camnot agnes aug error mo msg desire wile message cod
graph,k pointer landscape moto dy chart n stats speedo
hearth,link store picture bookkeepin
jellybean,i9003 wait v222 hmpf defy ok android moto vr xt926 baseban
style,disappear timedist label remain runrest timing lap split custom havent nic
road,eye cross neighbour side thicker offroad adventure elivation direction bridge building go happrns garden tall zag zi
liaise,runbike sloppy change chew interestin
detection,inception discrepancy coordinate si fault biking china section sgs
mark,thousand bike spot hunt isue scout rode rider zi
boost,cake interacts performance hotness december layout gripe pausestart fee
wildland,perfect speedometer majority authentication rocket luklckaly wife walker runner asks pay acre scientist parent firefighter fire fluctuates forgets forit hiker api
resume,prevent dialogue confirmation harder trackit activate stop forget nyou pause placement hit feb2014 clock winter button sportypal restart recordin
le,slicker guesswork mpr meant font nois
chocolate,teapoy inaccurat
omission,math pristine otherwis
bpm,alpha monitor obstruction rate ship h7 pointless australia miolink strap synchs mio heart monitoring energy cadence smart target zone preet
bummer,ace i9003 galaxy samsung scl lll samsumg fail s2 pad2 s4 crapware i9082 backyard kind
chip,provider device card directory memory backup sd broadcom sprin
remark,attempt icon report advice glitch enlarg
faulty,notice shelf anyone verge garman state googlemapway useless n4 air footprint get everythin
family,kmshr raja tnx friend journey couldnt document share tracks2mile
house,stillendomondo circle pattern neighbour dot crazy neighbourhood locatio biking sit stay loop doublebacks chair go draw haywire university campus ski
allow,priority shd selection approac
default,reverts measure rubbish change tolerance snowboard setting symbo
gradient,reading ridden maximu
km,scooter kmhr term modifies show l
wander,tangent town goole side niw show woo
whilst,cycling ace hill york liveelevation acuracy begrea
tell,navigate visit acre startpoint someone googlema
week,rock attempts fine os fusion cooles
fault,appalling photoroute proper shoulder hardware locus cent detection head percent mind bag competence tower antenn
number,sentence remedygoogle letter anyone droppin random sea word isue foot bold generates level output strea
mapmyride,respect disappoint disappointing ridei bias i9000 kit believ
cell,craziness reception network effect networks connectivity service connection coverage enlarge are
situation,hopeless majority arg nope country pabna secession b
mapmyfitness,geology dog crashing pristine improovments googlechrome meh form satelites runningactivity begreat revie
grrrrr,waze bounce blame antenna receive
fexibility,blah version edit manipulate pos saudi rever
reply,grandpa mapdata email eyeroll notification desk sent question comment say posibillity yea
type,choose chrome priority group sum versus select mention ladmarks filter wearcarry novelty activity gender stat
zigzag,lin
got,complet that
usage,toggle dnt heat sleep imp charge battery charger hour consume life cpu generation eater feb2014 winter eats note3 zl ea
driving,checkpoint majority accord stamp frustrate ware time document twenty moving movie readout i74
relation,cake wantneed enhance logging trackstill awesome motorcycle tag approach calculationstat offlin
w,overhead angle fc challenge razr muti droi
vehicle,gplay luck member pocket conference company abandon mining collect regard witness trek asker travel requirement team counting tal
conjunction,trust geology crashing transport glo garmin cyclemeter tracks2mile
create,return runrest split custo
improovments,configure geology cumbersome super mapmyfitness boater transport googlemaps utility form serf prediction favourite order begreat halfway gee adjustmen
veryyyyy,tume take delete fetch sooo video drawback locat
smarttracker,varies include delay weight lol extra eg goa
logging,location relation fashion geo internet connection mapmywal
route,ideal truck engage angle reverse round york square bridge availabla acuracy challenge follow muti trace deflection par
powerhouse,appalling vice nt punch beat waze cent myocation tolerance imagine noise hidden filter recognis
ty,gsensor wold observation wife cruise caloires person burnt imo counter spentthe body insert lunch calculate hm practice event burn calorie rode buff calculation runnng burne
customer,developer channel synthesis execution communication redesig
interface,holo tracksgone kmshr limit development font name tidy simple appal multitude expiry ui scheme nic
bike,weekyear gdocs penultimate today mark asks night motorbike exercise rode commute bother rider bicycle ride le
compatibilaty,back reverts rubbish change verdoon yea
spreadsheet,dont ease sheet merge table docs alot description operatio
motor,geology waypoints footpath walk p coffee transport form outdoor instruction rambler acuracy halfway ladmarks cycle garden paste progres
tick,second flakey fetch clock locat
export,choose wow csv transfer computer sdcardmytracks edit shd kmz kml select docs timestamps exportsimports kmlgpx import tip gpslogger clumsy send gpx gis format gmap file folder isnt pc inconvenien
reason,stick beast stall runnng closei
state,notice anyone web visualization page statistic faulty jumping preview weekly n4 de
speaker,breath sentence measure zero system assistant word pause office announcement doctor strea
capability,kmshr sharing multitude expiry share ui scheme fc
pirateware,f oops history sorry need bow hate thanx spyware quit pristine grate jerk frustration placeme intrusive delete read invasive explain logger overreach access loc hell c call garden contact dobt bitch collection comm watch permission calendar closei
layout,deal thumbsup boost prefer brand pit
handlebar,charge bag bicycl
frustration,hate spyware pristine atv jerk pirateware utility uninstalling wth overreach seperate consistency clog gre
idea,mechanism practice ux tracke
calculator,result spentthe calculate split estimate give timespee
report,remark landscap
care,community lightweight whatsapp outdoors gearth profile playback ghos
speedposition,library otg ant feetmiles add autopause gmaps chromecast teeks auto iuse please fix knot acknowledg
lag,respond extent wan curiosity avoid slowdown becomes flick cause percent ginger offer redesign home death myvtrcks screen halt widget grind lock difficult
locatio,snowshoe stillendomondo circle pattern stroll block crazy jump random kangaroo drunk baby house stay im loop doublebacks universit
tab,minmile frustrating zoom hrmile swipe traffic right title axis check scroll left landscape beige pain summary chart slid
head,punch shoulder hardcore fault mind employee id pac
treating,provocation mytracks nature htc googlemapway become firmware article win comingpackge bill sensatio
indicator,elevation duration soccer validate altimeter change remain mileage snowboard gai
infuse,q address samsung scl hv trademill i815
bicyclist,recommend indication scale rocket otherwise walker runner reboots scientist wider bar bozo manager hike
wherever,runbike sync trek begreat revie
dashboard,community success thumbsup prefer m8 c alcatel everything moa
issuesissues,inception dell deal thrice g1 venue suxit vgood favor gmail break author issu
slowdown,respond maxx razer performer alert lag becomes flick razr droid motorola hd fix widget j
runner,recommend perfect scale rocket walker wildland bicyclist reboots scientist parent par bar firefighter bozo kid forit hiker compete fac
creates,card abandon memory sd corrup
journey,day family continue camp confirm shu
jst,juncky fir thanx integrat dosent inbuilt dropbox earth synch interaction elapse browse mapsna
boater,shouldnt routespls mtn frustrate annotation alwaays improovments teeks recommendation favourite iuse sail encourage begreat toimportexport camnot boaties kno
instal,crapware kind
hole,pass mining algorithm collect data miner sunday reconnect
kmz,arcgis uploads wow adobe convert lightroom sdcardmytracks export kml timestamps send process converter gpx gis contain shp complite format facility file thirdparty weblink software mapmaker p
therefore,vision frequency ex segment pace distance fox increase minkm trackpath date goal give timespeed feedback readout categoriz
couldnt,f magnitude whatsapp family docgreat ae buttonoption pic alltrails adjustmen
gmaps,feetmiles speedposition attention iuse please fix magnus acknowledg
combine,history tnx grrrrrr posibillit
condition,proper humidity temperature sony insert bod weather tower unloc
chromecast,library fly wantneed otg gpxkml add cooool addons ons speedposition whats teeks awesome iuse asap handy please roller playback toimportexport fix replay acknowledg
effort,everytrail super bloaty to
chanel,tunein hopeless radio setup offroad networks arg planet pointless country pabna service moment secession internet bd fm documentatio
sec,minute talk min mile hint mi mile
biking,detection house mountain mess dir
provide,interacts streetview browser interest asapzte weekly n986 mapmaker cygi
placeme,history sorry spyware quit pirateware something announce access slaughter c contact dobt bitch googlebots calendar happens everythin
trail,tangent mountians print colorado hello foothill append bridleways topography re runhike shoreline occasio
discontinuity,fly malfunctioning tracksfiles wildfire compet
imho,everytrail north idol success observation differ right apps beast mapmyxxxx fringe superman yeh flame improvise v moa
informative,luck cumbersome fancy roo
disappoint,respect mapmyride disappointing ridei bias i9000 ki
latitude,shoulder stamp longitude navigatio
wilderness,tangent goole footpath thanx r hello screenhow bridleways z1 show offlin
io,wonderful gimp b520 ascend exllent practice fitness cyclemete
kcal,thankx cut itup niw keep ehh hitting worthy satellite forever
action,desktophomepage stick cpu optimus minimise risk button load decision launcher myvtrcks acciden
sense,anyone signal prefer blame drop flexibility accomplishment lead alcate
survey,ordnance background dropbox option mapping rute ptemium boaties sourc
tile,transfer generate exportsimports gp
endurance,horse try analysis ad itw
person,observation ty burnt counter practice event calorie potentia
right,pound redesignd eyeroll north beta dony tab imho xperiau desk scroll left gb drift introduce pain superman bore chart yeh flame yea
anger,pitty signet freebut package cmon signing security asapzte cannt n986 offer install update au
googlechrome,primary edit annotation crashing mapmyfitness flaw wish desktop keepe
captivate,s3 i9003 tatoo galaxy crash satnav q galax exllent samsung speedcadance scl sii samsumg s2 pad2 ii i8150 s4 note i9082 player i74
googlemapway,verge provocation streetview garman navigate mytracks nature flop pass faulty treating hope europe tonlovester firmware footprint article win bil
miss,pilot autopause twio avail gearth discipline glitchy trailerror featur
crap,fon
winner,library otg addons host razr kit thru j
whereas,burnt vgood refer calorie sourc
path,mapdata thousand mountians backwards moderate variety seldom drawn posibillity zig spik
foreground,part randomly sham
neats,interacts performance abscissa root stuff appsgoogle crapware interaction reader toimportexpor
title,minmile tracksgone hrmile tab axis gmap summary char
drainer,hog imp cellphone way cool sucker neat kille
ild,rubbish rezound thunderbolt ala s
hope,learn verge flop googlemapway programme
forget,bomb prevent dialogue confirmation harder trackit milestone isevery stop resume nyou pause closing greati placement hit push button zoomout fat press restart recording acciden
reboots,try recommend force walker bicyclist runner yay moment stall press hiker closeit clos
wearlink,ton wireless meant ant lack zephyrpolarlike colorado bluetooth speedcadance finer foothill h7 refer gramin reference hrms sensor glo ie garmin runhike toppeak zephyr hxm hrm panobik
york,whilst route googlemaps makeover disappear
matric,thankx feetmiles india unit system quirk australia kilojoules kilometer stopper sail metre mikm kilometre kno
shortcut,men annotation record heiner placement command button case fa
apps,everytrail gimp stature nature flop party imho beast fit mapmyxxxx load decision fringe hugh bill 
excellent,project thank
verdoon,back reverts neighbour driver forth compatibilaty bottom idk favourite greatoilfeild happrns xellent tanke
trackstill,l fly itd relation exploratory favourite youngster freeze grey froz
flaw,weekyear edit love googlechrome accessory bullshit invest simplicit
resent,thrice g1 versatility cardiotrainer prevents ct upgrade user makeover iit issu
burnt,spent wold observation caloires ty person whereas counter spentthe boooo insert count calculate practice burn accelerometer calorie buff extra runnng gende
gingerbread,frustrating ginge
networks,craziness wireless reception network effect cell chanel a88 service internet connection fm documentation are
continue,priority journe
barometer,amazing instance meaningless difference hardware acro stability accelerometer compass calibrate competence antenn
slope,elevation point altimeter onthefly label remain seldom reflect speedo
