 Noun,Adjectives and Verbs
pitty,fiximg version messager mistake signing pos anger jan security cannt install re update july aug mo cod
bomb,cake annotation zephyrpolarlike trackit pristine colorado forget foothill pausestart auto reference sensor zephy
inception,osmand detection issuesissues flakey gmail worldwide coverage malaysi
kerenls,raters airdroid combination repeat mistaken folder myvtrcks widge
respond,sometime lag slowdown becomes redesign razr widget j
snowshoe,stillendomondo army stroll randomly baby locatio greati loop hit doubleback
location,provider mock motox logging focus sharingdirection photos fashion entry shoot approac
extent,curiosity lag becomes flick cause brokenwill ginger bold home death screen widget loc
k,l graph lll screenhow moto 
updating,failure signet froyo signature package reupload sign dumb ware gus paclage qa lisence reinstall wont thats installation install say agnes error afoot messag
psw,problem pls gmail gee speedpl
minmax,velocity thumbsup rebound wider kmh hell bikers spee
cycling,okay computer hill whilst plug liveelevation lo
unfortunate,doc north integrat dosent inbuilt conside
ideal,fly disappointment wasnt primary route alot acuracy reference begreat follow trace zephy
appreciate,alpha humidity integrate party temperature monitor spot rate ship ruin synchs pedometer heart target zone preet
holo,limit development versatility interface name tidy hv simple simpleuser multitude design makeover match expiry ui scheme fc
appalling,join understand trust goole endonondo space cent tolerance worth fault powerhouse represent installs conection china hidden seperate mind recognise tracking markerswaypoints grey mylocation g
tangent,footpath charm print wander trail wilderness hello bridleways wearcarry sho
enter,priority dark experience cardiotrainer task runrest ct user makeover iit plethora split custo
blah,simpler snag version haaaaay uninstall alwaays pos fexibility vgood exploratory wapp bus
extsd,
f,b click spyware pirateware couldnt read buttonoption announce routine c call contact dobt bitch comm grrrrrr googlebots calendar everythin
horse,analysis endurance avail ad itwe rut
dell,patchy venue nexus4 issuesissues section broken difficult
improvement,project room opportunity nic
size,sits compare background runkeeperendomondo loop doublebacks lightsmal
measurement,change unit system quirk backup stopper hang mikm sprin
rucksack,varies day include coach v02max caloires insert weight hrmax camp extra confirm reflect shut gender malefemale height drainag
pound,fiximg north right monthwee
vice,punch lightweight whatsapp inconvenience powerhouse navihation useless hv employee wifi vers
chu,desktophomepage dialogue confirmation harder click placement hit minimise risk button product zoomout portfolio press acciden
configure,quite photoroute kmshr validate super improovments recorder utility serf simple design scheme adjustment cyclemete
textfacebook,toggle list twitter fb g battery tnx drink life share english grrrrrr faceboo
towards,hibernates side bottom elivation g
complaint,quite well utility quic
prevent,connects trackit resume forget jumping button fa
refuse,milestone record quits closing solution pt student restar
sooooo,learn gimp drive cooool teeks docgreat syncs follow rute mapchartstats brows
slicker,charm le promise look vacation journa
failure,updating signet signature package topo sign dumb ware paclage reload qa lisence something status thats installation install say agnes error msg messag
cry,river broken anno
wonderful,gimp wear abscissa benefit ascend io simplicity interaction g525 calculationstat rotation standard mapsnav sgs
minmile,tracksgone hrmile swipe tab title axis check appal summary char
stillendomondo,snowshoe circle pattern place block crazy jump baby house locatio stay spot im loop hunt doublebacks isue university ski
game,geology millisecond soccer snowboard year pt field inclusio
s3,ace i9003 tatoo galaxy satnav q nature party samsung captivate scl fit sii samsumg matias note i9082 player bill bi
gplay,proper pass effect jerk vehicle connectivity mining bloatware memory service data constrains miner sunday collection storage reconnect
mph,kph kilojoules illinois km
weekyear,penultimate bike flaw night motorbike rider rid
bt359,device jan tiein sir
trip,plot rest whole length iphone spb resembles hike kayaker reality chunk freeze kaya
breath,kangaroo prompt speaker sound assistant reporting office announcement docto
playservice,thing framewor
multiple,priority save marathon readou
grandpa,reply desk trasfer phone bos couc
tunein,radio setup chanel arg planet country service moment music internet interval f
toggle,textfacebook heat hog power battery drink sync consume usefulness life usage chew cpu suck generation eater drain kill sucker eats zl eat standb
amazing,difference integrat acro barometer imagine hop seperate compass believe incorporat
community,choose beat care dashboard challenge lo
regain,motox trust fashion i
ace,s3 i9003 tatoo galaxy guy q exllent samsung bummer whilst scl lll screenhow sii samsumg s2 pad2 ii s4 note i908
try,flop force success endurance reboots stall itwe clos
arcgis,uploads adobe wonder convert lightroom kmz kml timestamps converter gis shp format thirdparty mytrack softwar
circle,stillendomondo pattern neighbour dot crazy jump randomly house locatio stay loop square doublebacks repeat bookkeeping university campus skip stree
better,simpler pursuit integrat hardcore coach respect ae camands greatoilfeil
yes,stage sham
oops,fiximg sorry bow pirateware read invasive grab explain logger overreach remove access c contact update dobt bitch comm permissio
favorite,mount sdcardmytracksgpx sdcardgpslogger command deletion brilliant bind execute busybox anno
strava,edit workout snowboard xellent alltrail
come,reinstallatio
pattern,stillendomondo circle neighbour dot crazy randomly neighbourhood house locatio sit stay loop doublebacks chair go draw haywire repeat university campus but
provider,location mock card chip focus sharingdirection memory backup sd broadcom platform sprin
recommend,rocket walker bicyclist runner reboots avid agood definition bozo hike
doc,unfortunate fb manage integrat tnx upload root share interaction integration facility image mapsnav posibillity pointtopoin
hopeless,cross radio offroad sort situation chanel arg pointless country pabna secession ap bd fm documentatio
wan,letter frustrating curiosity blank lag becomes flick cause plz ginger bold home death screen widget lock difficult
town,niw wander afterward
kept,giant jump reboot drain injects motio
men,mount sdcardmytracksgpx sdcardgpslogger hmpf shortcut heiner command newdir case bind consider execute busybox till beside
uploads,arcgis wow adobe ease kmz kml syncs converter shp fusion format thirdpart
link,alpha synchronize fb session aspect wordpress tnx account hearth dropbox earth picture preview mio share grrrrrr image gfaceboo
join,appalling understand correlation inconvenience hv shite recognise markerswaypoints comput
back,reverts neighbour rubbish forth bounce change galax compatibilaty verdoon greatoilfeild introduce xellent reinstallatio
replacement,geology bulldozer countryside coffee lost progres
guesswork,elevation canwe altimeter le grade affect bug loss gai
tracksgone,minmile mapdata kmshr hrmile interface title good axis tidy prediction appal ux availabla lost summary opportunit
overhead,maxx w camera razr droi
globe,mock motox osmand oof accuracy worldwide coverag
sentence,zero number speaker fc nyou word pause brief course droid strea
quite,configure complaint cellphone validate endomondo good well utility serf simple predictio
mapdata,tracksgone email fb tnx address quits reply path axis sent appal share grrrrrr image posibillity gfaceboo
list,textfacebook history twitter meant spyware read access loc call contact comm calenda
rock,juncky week avid syncs nexus interaction o mapmywalk brows
remedygoogle,notice anyone calender number plz jw regard n4 photo rever
mock,location provider globe motox osmand focus sharingdirection prevents worldwide asap quality platform acknowledg
signet,updating failure freebut download signend signature package reupload cmon topo sign ware messager fails signing gus paclage anger security reload qa lisence wont fail cant offer guys status thats installation install doesnt solve say file agnes blog error msg desire wile messag
elevation,guesswork canwe validate altimeter info si indicator slope remain inch grade seldom ft max bug figure gain stat speedon comput
giant,kept gap reboot cause injects wildfir
understand,appalling join trust lack inconvenience hv pausestart description mind hrms vers
vision,therefore pace sky trackpath timespeed readou
item,millisecond owner transfer star continuation hurry fcc glass mapchartstats coolest inclusio
inaccuracy,
bugginess,fiximg update
correlation,join find army render inconvenience outdoors atv gearth satelites pausestart worthless seperate consistency shite reality beware knif
device,bt359 priority chip wearcarry tiein sirf broadco
waste,checkpoint dnt imp cellphone majority accord stamp frustrate time shame moving ghost precis
letter,wan curiosity number becomes flick plz bold death scree
motox,location regain globe mock lack verizon accuracy prevents photo
learn,sooooo odd india whatsapp cooool hope connectivity hey brows
explorer,guys file thin
everytrail,raters nature mapmyrun effort imho apps dropout ala optimus load decision fringe bloaty 
reverts,back rubbish forth galax default compatibilaty verdoon introduce reinstallatio
plan,advance froyo version vgood pre favor exploratory future author mobile installg review bus
i9003,s3 ace tatoo galaxy q din ascend galax exllent samsung jellybean bummer captivate speedcadance scl defy ok samsumg android s2 pad2 ii s4 note i9082 player panobike i74
choose,community ability beat priority type export select docs import clumsy empty let log activit
simpler,blah better snag version haaaaay suxit gus pos exploratory idk camands wapp future revert aug bus
problem,psw signing ongoing n4 future gee kayaker installg speedplz squaw tho
trust,appalling regain understand primary inconvenience conjunction malfunction china mind pt id hrm warmu
tatoo,s3 ace i9003 galaxy crash q mini force exllent samsung captivate scl sii ok samsumg s2 pad2 ii s5 s4 note i9082 stal
alpha,appreciate link connects party monitor bpm rate ship bloatware miolink synchs mio heart monitoring energy cadence smart zone preet
criticism,light differ competitor blood
velocity,minmax id hoo
management,smoother directory jerk memory clog sprin
nt,punch featuresdoes shuts bravoandroid inconvenience corrects myocation powerhouse imagine navihation hv employee versa recognise markerswaypoint
presentation,summer mining invasion data mountain miner nea
ability,choose osmand pre discipline challenge win lol goal allow
checkpoint,waste snag majority end stamp reverse complet driving inbuilt appsgoogle time everytime moving reader elapse resync mapsna
snag,blah simpler checkpoint version frustrate haaaaay alwaays suxit favourite everytim
library,otg ant addons speedposition chromecast winner teeks iuse please platform camnot fix thru acknowledg
minute,note2 sleep talk hour sec min speaking hint twenty qua
mpr,le speedpace baseban
plot,trip resembles odomete
thx,tho confusion towe
cover,touch countryside restar
eye,tume take road ongoing vacation operation beside
perfect,speedometer authentication rocket luklckaly wife walker wildland runner asks acre scientist parent firefighter fire lighter fluctuates forgets reliability kid forit hiker api
advance,plan otherwise star rating malaysia thanks beginnin
history,list sorry g quit grate pirateware combine placeme read grab overreach access detail loc call contact dobt bitch collection comm permissio
gimp,sooooo wonderful competition hardcore io apps sportstracker seperate interaction april browse fitness cyclemete
pod,foot sail kno
recognize,waze noisy los
redesignd,north dony right xperiau look gb simplicity bore thin
cross,hopeless intersection thicker offroad road arg country pabna secession b
maxx,overhead razer performer b520 kitkat v222 slowdown fc defy cm101 ic razr droid motorola xt926 hd stock j
treadmill,render outdoors atv tolerance navihation seperate consistency input shite steppe
geology,game replacement shouldnt soccer mtn annotation crashing coffee flight super manipulate mapmyfitness conjunction improovments motor recorder transport googlemaps utility form serf china halfway field progres
people,
truck,engage bulldozer thicker adventure route bridge availabla acuracy follow delhi categoriz
response,place bullshit fall kmph haywire competito
everyone,city locus imo body practice composition metabolism complain softwar
notice,remedygoogle anyone calender page faulty state jw regard preview n4 de
duration,witth isevery indicator wider speed sportypal restar
galaxy,s3 ace i9003 tatoo crash satnav q mini galax exllent samsung bummer captivate speedcadance scl lll screenhow sii samsumg matias s2 pad2 ii s4 note i9082 player backyard kind
radio,tunein hopeless setup chanel arg planet pointless country pabna service moment music secession internet bd fm documentatio
duty,kilometershr hour run timebattery cm101 zap hint shame processor stoc
runbike,render outdoors liaise wherever begrea
find,correlation cut outdoors myocation destination satelites london le
craziness,reception effect cell networks hello range dy are
desktophomepage,chu dialogue confirmation harder action stick placement hit minimise risk button zoomout fat press launcher myvtrcks acciden
twitter,textfacebook list kmshr otg tnx friend profile host retrace share grrrrrr faceboo
shouldnt,geology frustrate annotation mini cumbersome boater field enjoy note bloaty fcc note
millisecond,game item note2 owner soccer inability buggy year field maps month inclusio
speedometer,perfect lot backwards wife wildland asks acre drawn parent firefighter fire po fluctuates go programmer fori
dnt,waste heat hog batter enhancement battery kilometershr consume usefulness life usage teeks hungry generation eater kill iuse sucker ruin shame xperia note3 zl eat killer drainag
goole,appalling punch cache layer mean icon blank wander wilderness hello bridleways shite recognise elapse markerswaypoints position show grey locate listi
sometime,respond fan execution iuse redesign roller j
gdocs,edit itd penultimate bike workout square night rid
email,mapdata notification friend address quits reply axis check sent comment share english posibillity gfaceboo
photoroute,configure hardware trackin fault document gee tho
heat,toggle dnt hog battery kilometershr consume usefulness life usage chew cpu generation eater drain kill wapp zap generates processor note3 confirm zl drainag
search,hitting worthy fetch drawback player satellite locat
freebut,signet signend signature package signing anger security cannt attention update camnot msg pit
part,performance trackin foreground iphone bos ban
poorapplication,developer perspective money channel fan mechanism synthesis smartphone communication ux redesig
shelf,garman faulty mining data put constrains miner sunday till corrup
note2,minute millisecond authentication continuation core quad map
doubt,connectivity buggy neat month bi
punch,vice nt goole waze shuts whatsapp hardcore inconvenience powerhouse head navihation installs synch seperate mind shite attach employee versa markerswaypoint
sleep,minute battery charger hour usefulness usage unistalling cpu note3 standb
runkeeper,arm movement camands vs geocach
owner,item millisecond session drive dropbox earth share follow mapchartstats inclusio
sits,size battery background drink consume usefulness life chew hungry drain zap thro
stutter,efficient control versatility reporting multitude makeover expiry minkm ui band scheme feedback voic
army,snowshoe correlation twio pausestart spb reality detects feature beware knif
ton,meant zephyrpolarlike bluetooth wearlink finer h7 refer consumes hrms sensor potential glo hxm hr
longer,sprea
incorrect,ex rebound evrage liveelevation max distance fox speed average informatio
gps,provocation waze signal hardware loses atleast stability blame drop lead antenna receive
neighbour,circle pattern back dot crazy randomly neighbourhood road house verdoon sit loop doublebacks chair building go draw haywire repeat university campus but
place,stillendomondo response river cut jump treck spot im gripe isue scout entry pin besides zi
download,signet signature package topo sign ware paclage security lisence wont install ap error msg messag
measure,change unit system default speaker quirk stopper repeat fh mikm stree
hog,toggle dnt heat imp power battery kilometershr onthefly consume usefulness life drainer chew cpu hungry generation eater drain kill wapp sucker zap eats zl eat interesting kille
l,k b dony trackstill hungry simplicity bore gre
anyone,remedygoogle notice info calender faulty number state sense jw accessory n4 invest somebody throw guid
razer,maxx performer kitkat slowdown fc cannt cm101 eater ic m8 razr droid motorola xt926 hd stock jb cygi
maintain,engage blame lost goal l
hasbeen,programme signal esta messager teleport execution firmado el miscalculation monitoring error msg magnus messag
instance,lose meaningless countryside hardware barometer execution stability runningactivity noisy unloc
imp,waste hog cellphone privacy stage usage drainer mining invasion drain data sucker miner internet eats connection collectio
wow,uploads sdcardmytracks analysis export kmz kml select send converter gpx contain format thirdpart
cake,bomb wantneed enhance enhancement benefit frustrate seat boost relation heartbeat pausestart hm simplicity handy s5 interaction calculationstat think playback dirt incorporat
soccer,game geology millisecond indicator snowboard year field inclusio
csv,sdcardmytracks visualizer generate export kml timestamps exportsimports kmlgpx import longitude gpslogger clumsy geotag gpx contain format somebody file p
lot,speedometer featuresdoes fun utility po fluctuates interestin
indication,scale notification ex loses bicyclist bar trademill fox lawye
setup,tunein radio verge timedist chanel runrest moment training interval fm compet
featuresdoes,nt lot myocation tolerance nope markerswaypoints interesting comput
routespls,frustrate dony love consume boater pre wheelchair hungry encourage begreat dir
proper,gplay manage hardware fault condition installs tech ask towe
okay,cyclin
waypoints,cut coordinate walk coffee motor transport instruction calaries halfway ladmarks garden paste zag clai
verge,setup random flop faulty googlemapway hope screwy useless injects footprint get pack interval wood alltrail
froyo,updating plan signature package haaaaay htc dumb gus paclage qa bravo install mobile aug desire wile cod
yesterday,second today speaking chair fall kmph couch sunda
realize,txt prefer tonlovester didn
fly,ideal synchronize wantneed disappointment chromecast discontinuity trackstill availabla acuracy begreat interaction follow deflection repla
juncky,rock attempts jst dropbox avid earth syncs synch google interaction product amaze portfolio browse mapsna
cellphone,quite waste imp accord frustrate drainer hungry sucker shame g525 competitor gu
fiximg,pitty pound oops bugginess updates release re update cooles
application,money mapsnavigator abandon serf introduce hang trekker counting api
contactsy,garman ring bothe
synchronize,link fly session dropbox buttonoption spread acuracy follow trace pic resync brows
footpath,tangent side stops walk motor wilderness pointer instruction screenhow dy motivation garden show front park beginnin
kmshr,configure tracksgone twitter bulldozer tnx friend super family interface capability tidy simple prediction appal multitude document expiry share selection english pic grrrrr
sorry,oops history bow spyware quit pirateware placeme read invasive grab explain logger overreach announce routine access loc hell c call contact dobt bitch comm permission googlebots calendar everythin
discrepancy,stops dog walk detection exploratory instruction rambler mile illinois halfway hint zag wil
fast,rocket walker mention photos scientist wherehow match shoot ki
consolidate,runkeeperendomondo con simpleuser lightsmall informatio
eyeroll,north neighbourhood reply right xperiau sit desk left gb kmph superman couch yeh yea
pursuit,better count accelerometer health calorie calculation counting fram
precision,match tracke
stroll,snowshoe block baby locatio loop shorelin
power,toggle hog batter battery consumption consume life stick chew eater drain sucker zap consumes zl eat interesting kille
transfer,item computer card sdcardmytracks hand export tile kmlgpx import sd clumsy send gpx file folde
tume,eye take veryyyyy ehh connect hitting fetch video drawback locate receive
malfunctioning,flight discontinuity nebraska percen
frustrating,wan zoom swipe traffic light tab gingerbread scroll ginger pain char
project,improvement luck excellent dev team opportunity ptemium thank
need,spyware jerk pirateware read privilege explain logger overreach access loc c call fh contact dobt bitch permission calendar identit
instability,crash reverse arm trial flakey circonstances trace malaysi
scooter,km rebound term trademill kmh speed averag
math,mtn news omission simple ma
crash,tatoo galaxy instability frustrate captivate sii pad2 bloaty trace halt grin
provocation,gps lose garman signal mytracks nature chipset atleast keep treating googlemapway firmware article platform bill lea
beat,community choose render powerhouse challeng
wantneed,cake fly enhancement performance benefit myfitnesspal gpxkml otherwise relation chromecast awesome gripe pausestart trek handy begreat calculationstat toimportexport hiker replay jun
fb,textfacebook doc link mapdata post tnx preview share grrrrrr facebook image gfaceboo
clearer,visualizer con tool bear lightsmal
adobe,arcgis uploads wonder convert lightroom kmz kml timestamps resolve converter shp product format thirdparty mytrack weblink softwar
programme,hasbeen signal esta messager paclage teleport firmado correctamente el miscalculation error ms
charge,usage handleba
north,unfortunate pound redesignd eyeroll beta imho right xperiau desk scroll left gb pain superman yeh consider flame inaccurate yea
lose,instance provocation signal drink nexus4 stability circuit summary receiver reconnect
signend,signet freebut signature package topo sign ware gus lisence guys thats installation install doesnt solve file agnes error messag
attempts,juncky ease sheet merge week table docs upload syncs synch spread fusio
majority,waste checkpoint authentication luklckaly wildland situation driving firefighter fire twenty elapse forit froz
wonder,arcgis adobe convert lightroom charles dark kml ray i8150 converter shp format thirdparty afoo
interacts,streetview odd performance abscissa endonondo myfitnesspal boost provide neats docgreat root intergrate appsgoogle feel wider topography synch mind afterward sportypal interaction wit addition playback browse mapsnav cygi
performer,maxx razer slowdown verizon razr droid motorola xt926 hd j
ordnance,survey dropbox option initiate mapping granularity rute room mapchartstats ptemium give boaties sourc
window,second seat clock happen
raja,tnx whatsapp family ae share english get pic grrrrr
waze,recognize punch gps signal shuts middle atleast myocation grrrrr powerhouse stability blame attach lost antenna receive
work,beta fine cent well g2 weeken
zoom,frustrating swipe traffic light icon mode tab check scroll landscape chart slid
b520,maxx kitkat ascend wife v222 cruise io defy android vr droid motorola xt926 hd baseband stoc
b,f l session 
scale,indication rocket wise otherwise walker bicyclist runner wider bar bozo manager hike
developer,poorapplication perspective channel inability customer teeks smartphone attention communication bug tg
resolution,topo display useless h
chrome,browser sum see type analyze font desktop aggregate wearcarry novelty activity stat
canwe,guesswork elevation validate altimeter si grade break gain calculationsta
convert,arcgis adobe wonder lightroom kmz kml converter gis shp format thirdparty mytrack softwar
meaningless,instance satnav droppin hardware chipset acro barometer sony stability startup sourse noisy bloody competence antenn
authentication,perfect note2 majority luklckaly wildland pay acre core firefighter quad forgets reliability forit api
batter,dnt power docgreat something sent eater sucker ea
guy,ace browser samsumg hey sooo i9082 drawback identit
point,developers end angle return label slope somehow reflec
disappointment,ideal fly wasnt fir frustrate annotation itd wth begreat g525 calculationstat trace addition mapmywalk dir
satnav,s3 galaxy meaningless endonondo hardware loses samsung captivate scl man sii samsumg ii sourse note i9082 player tower antenn
cache,goole streetview city endonondo layer mean mode pigeon topograph
bt,chipset support bluetooth speedcadance compatibility sail quality energy toppeak smart panobik
hibernates,towards curiosity bottom yard suspect go home death scree
signature,updating failure signet freebut download froyo signend package topo sign bravoandroid dumb ware signing paclage security reload qa lisence wont install say camnot agnes aug error mo msg desire wile messag
enhance,cake benefit terrain love oof relation moreorless topography rotation offline defeat standard mapsna
driver,verdoon greatoilfeild shot someone calaries switch tanke
wear,wonderful cmon abscissa member ascend integrate poalr support defy man android asker g525 vr integration team zephr watch panobike baseband mapsnav hoo
